{
  "logline": "Casey Chen, a junior data analyst, must steal back ten years of lifespan from LifeHock's vault despite LifeHock's time-repo agents and a mentor's betrayal.",
  "word_count": 24,
  "metadata": {
    "project_id": "the_immortality_tax_20250820_024905",
    "step": 1,
    "version": "1.0.0",
    "created_at": "2025-08-20T02:50:00.001504",
    "model_name": "gpt-5",
    "temperature": 1.0,
    "seed": 42,
    "prompt_hash": "6f58ee801923f6fa8947ac9f579d624226c47f1eb0e5b37983a6ade5233a2e24",
    "validator_version": "1.0.0",
    "hash_upstream": "4073fe6a624192f179b626f242efe05ddef6ab64465354b327f95591c001ba6d"
  },
  "lead_count": 1,
  "components": {
    "lead_name": "Casey Chen",
    "lead_role": "junior data analyst",
    "external_goal": "steal back ten years of lifespan from LifeHock's vault",
    "opposition": "LifeHock's time-repo agents and a mentor's betrayal"
  }
}