{
  "logline": "Mira, an internal affairs detective, must solve a police shooting despite falling for the prime suspect, her target's brother.",
  "word_count": 19,
  "metadata": {
    "project_id": "e2e_novel_20250819_143811",
    "step": 1,
    "version": "1.0.0",
    "created_at": "2025-08-19T14:38:24.592685",
    "model_name": "claude-3-5-sonnet-20241022",
    "temperature": 0.2,
    "seed": 42,
    "prompt_hash": "2d0e4c755e9bd3b1bf03f5361ede4b9ebd532ffcc5324184e968a9c37d5cadd3",
    "validator_version": "1.0.0",
    "hash_upstream": "64be876e5fa3892a0174e672e89af640fd4b271268d8d8fef80e95e9220df67a"
  },
  "lead_count": 1,
  "components": {
    "lead_name": "Mira",
    "lead_role": "internal affairs detective",
    "external_goal": "solve a police shooting",
    "opposition": "falling for the prime suspect, her target's brother"
  }
}