{
  "logline": "Mira, an internal affairs detective, must solve a councilman's murder despite falling for the prime suspect's forbidden alibi.",
  "word_count": 18,
  "metadata": {
    "project_id": "e2e_novel_20250819_144033",
    "step": 1,
    "version": "1.0.0",
    "created_at": "2025-08-19T14:40:44.318919",
    "model_name": "claude-3-5-sonnet-20241022",
    "temperature": 0.2,
    "seed": 42,
    "prompt_hash": "0c4725996ecf8bca929785e6cba0f391083d40de039e3fb53998560f07466938",
    "validator_version": "1.0.0",
    "hash_upstream": "5ca5f45b6b8f680e17ef649da843fd936603c7387d1c325070687a86c8af2d19"
  },
  "lead_count": 1,
  "components": {
    "lead_name": "Mira",
    "lead_role": "internal affairs detective",
    "external_goal": "solve a councilman's murder",
    "opposition": "falling for the prime suspect's forbidden alibi"
  }
}