{
  "logline": "Mira, an internal affairs detective, must solve a police shooting despite falling for the prime suspect, her target's brother.",
  "word_count": 19,
  "metadata": {
    "project_id": "smoketestnovel_20250819_133425",
    "step": 1,
    "version": "1.0.0",
    "created_at": "2025-08-19T13:34:36.906345",
    "model_name": "claude-3-5-sonnet-20241022",
    "temperature": 0.2,
    "seed": 42,
    "prompt_hash": "47dcd25b3166bc171f832f5f76ba79f1bb54731a786ccc058112154dad4039b2",
    "validator_version": "1.0.0",
    "hash_upstream": "b86b7100fbf2bf53cf232bdb5c2f7672338ef4e999c1fa8cd2c39a51197d44bb"
  },
  "lead_count": 1,
  "components": {
    "lead_name": "Mira",
    "lead_role": "internal affairs detective",
    "external_goal": "solve a police shooting",
    "opposition": "falling for the prime suspect, her target's brother"
  }
}