{
  "logline": "Maya, an internal affairs detective, must solve a police shooting despite falling for the prime suspect, her target's brother.",
  "word_count": 19,
  "metadata": {
    "project_id": "smoketestnovel_20250819_002131",
    "step": 1,
    "version": "1.0.0",
    "created_at": "2025-08-19T00:21:41.535548",
    "model_name": "claude-3-5-sonnet-20241022",
    "temperature": 0.2,
    "seed": 42,
    "prompt_hash": "71f9908d9579ede3e05dd076c68f52be0347b5d3978015d93564d6f45aa367f9",
    "validator_version": "1.0.0",
    "hash_upstream": "03243ef5020a081ce3018ffb1b46980594a54ab9f13f76e3fb5a36ee560534e4"
  },
  "lead_count": 1,
  "components": {
    "lead_name": "Maya",
    "lead_role": "internal affairs detective",
    "external_goal": "solve a police shooting",
    "opposition": "falling for the prime suspect, her target's brother"
  }
}