{
  "logline": "Maya, an internal-affairs detective, must expose the conspiracy behind a police shooting despite obstruction from her mentor and a leadership cover-up.",
  "word_count": 21,
  "metadata": {
    "project_id": "full_e2e_test_novel_20250821_105454",
    "step": 1,
    "version": "1.0.0",
    "created_at": "2025-08-21T10:55:34.385842",
    "model_name": "gpt-5",
    "temperature": 1.0,
    "seed": 42,
    "prompt_hash": "d3c1afbffb4c1acaa00062de4012d27e7ecf3ffa2d24ab83e92b9c9102a88e23",
    "validator_version": "1.0.0",
    "hash_upstream": "abe2bdab7dce58c4858b47a72b8e828deaa1380f979fccac66f025be45070647"
  },
  "lead_count": 1,
  "components": {
    "lead_name": "Maya",
    "lead_role": "internal-affairs detective",
    "external_goal": "expose the conspiracy behind a police shooting",
    "opposition": "obstruction from her mentor and a leadership cover-up"
  }
}